{
  "$schema": "https://json-schema.org/draft/2020-12/schema",
  "$id": "https://mdbase.dev/contracts/schemas/catalog.v2.schema.json",
  "title": "mdbase contract catalog v2",
  "type": "object",
  "required": [
    "catalog_version",
    "id",
    "name",
    "description",
    "homepage",
    "publisher",
    "contracts",
    "packs"
  ],
  "properties": {
    "catalog_version": { "const": 2 },
    "id": { "$ref": "#/$defs/id" },
    "name": { "type": "string", "minLength": 1 },
    "description": { "type": "string", "minLength": 1 },
    "homepage": { "type": "string", "format": "uri" },
    "publisher": {
      "type": "object",
      "required": ["name", "url"],
      "properties": {
        "name": { "type": "string", "minLength": 1 },
        "url": { "type": "string", "format": "uri" }
      },
      "additionalProperties": false
    },
    "contracts": {
      "type": "array",
      "items": { "$ref": "#/$defs/contract" }
    },
    "packs": {
      "type": "array",
      "items": { "$ref": "#/$defs/pack" }
    }
  },
  "additionalProperties": false,
  "$defs": {
    "id": {
      "type": "string",
      "minLength": 3,
      "maxLength": 128,
      "pattern": "^[a-z][a-z0-9]*(?:[._-][a-z0-9]+)+$"
    },
    "version": {
      "type": "string",
      "pattern": "^(0|[1-9][0-9]*)\\.(0|[1-9][0-9]*)\\.(0|[1-9][0-9]*)(?:-[0-9A-Za-z-]+(?:\\.[0-9A-Za-z-]+)*)?(?:\\+[0-9A-Za-z-]+(?:\\.[0-9A-Za-z-]+)*)?$"
    },
    "digest": {
      "type": "string",
      "pattern": "^sha256:[0-9a-f]{64}$"
    },
    "relativeUrl": {
      "type": "string",
      "pattern": "^\\./(?!.*(?:^|/)\\.\\.(?:/|$)).+$"
    },
    "contractRef": {
      "type": "object",
      "required": ["id", "version", "digest"],
      "properties": {
        "id": { "$ref": "#/$defs/id" },
        "version": { "$ref": "#/$defs/version" },
        "digest": { "$ref": "#/$defs/digest" }
      },
      "additionalProperties": false
    },
    "standard": {
      "type": "object",
      "required": ["name", "version", "scope", "references"],
      "properties": {
        "name": { "type": "string", "minLength": 1 },
        "version": { "type": "string", "minLength": 1 },
        "scope": { "type": "string", "minLength": 1 },
        "references": {
          "type": "array",
          "minItems": 1,
          "items": { "type": "string", "format": "uri" }
        }
      },
      "additionalProperties": false
    },
    "contract": {
      "type": "object",
      "required": [
        "id",
        "version",
        "name",
        "description",
        "contract_type",
        "digest",
        "artifact",
        "standards"
      ],
      "properties": {
        "id": { "$ref": "#/$defs/id" },
        "version": { "$ref": "#/$defs/version" },
        "name": { "type": "string", "minLength": 1 },
        "description": { "type": "string", "minLength": 1 },
        "contract_type": { "enum": ["record", "event", "action"] },
        "digest": { "$ref": "#/$defs/digest" },
        "artifact": { "$ref": "#/$defs/relativeUrl" },
        "standards": {
          "type": "array",
          "items": { "$ref": "#/$defs/standard" }
        }
      },
      "additionalProperties": false
    },
    "display": {
      "type": "object",
      "required": ["name", "summary", "category", "audience", "icon"],
      "properties": {
        "name": { "type": "string", "minLength": 1 },
        "summary": { "type": "string", "minLength": 1 },
        "category": {
          "enum": ["people", "work", "research", "calendar", "infrastructure", "other"]
        },
        "audience": { "enum": ["general", "developer", "infrastructure"] },
        "icon": { "type": "string", "minLength": 1 },
        "badges": {
          "type": "array",
          "items": { "type": "string", "minLength": 1 },
          "uniqueItems": true
        }
      },
      "additionalProperties": false
    },
    "installedType": {
      "type": "object",
      "required": ["name", "label"],
      "properties": {
        "name": { "type": "string", "minLength": 1 },
        "label": { "type": "string", "minLength": 1 }
      },
      "additionalProperties": false
    },
    "installation": {
      "type": "object",
      "required": ["visibility", "recommendation", "primary_type", "types"],
      "properties": {
        "visibility": { "enum": ["default", "advanced", "hidden"] },
        "recommendation": { "enum": ["user", "optional", "integration-managed"] },
        "primary_type": {
          "oneOf": [
            { "type": "string", "minLength": 1 },
            { "type": "null" }
          ]
        },
        "types": {
          "type": "array",
          "minItems": 1,
          "items": { "$ref": "#/$defs/installedType" }
        },
        "caution": { "type": "string", "minLength": 1 }
      },
      "additionalProperties": false
    },
    "pack": {
      "type": "object",
      "required": [
        "id",
        "version",
        "name",
        "description",
        "digest",
        "provision",
        "provides",
        "resource_count",
        "display",
        "installation"
      ],
      "properties": {
        "id": { "$ref": "#/$defs/id" },
        "version": { "$ref": "#/$defs/version" },
        "name": { "type": "string", "minLength": 1 },
        "description": { "type": "string", "minLength": 1 },
        "digest": { "$ref": "#/$defs/digest" },
        "provision": { "$ref": "#/$defs/relativeUrl" },
        "provides": {
          "type": "array",
          "minItems": 1,
          "items": { "$ref": "#/$defs/contractRef" }
        },
        "resource_count": { "type": "integer", "minimum": 1 },
        "display": { "$ref": "#/$defs/display" },
        "installation": { "$ref": "#/$defs/installation" }
      },
      "additionalProperties": false
    }
  }
}
